basic_info_brand,basic_info_family,basic_info_reference,basic_info_name,basic_info_produced,basic_info_limited,case_material,case_glass,case_back,case_shape,case_diameter,case_height,case_lug width,dial_color,dial_material,dial_indexes,dial_hands,movement_type,movement_brand,movement_caliber,movement_display,movement_diameter,movement_jewels,movement_reserve,movement_frequency,movement_time,description,image_link
Archimede,Pilot,,Pilot 45 Automatic Stainless Steel / Black / Bracelet,,No,Stainless steel,Sapphire,Open,Round,45.00 mm,10.00 mm,,Black,,Arabic Numerals,Sword,Automatic,Sellita,SW200-1,Analog,25.60 mm,26,38 h,28800 bph,"Hours, Minutes, Seconds","Classic design, engineering precision and functionality are the guidelines for this outstanding chronograph.

This Pilot 45 is powered byan automatic movement by Sellita. The solid crafted three-piece case with sapphire crystal is made from finely brushed stainless steel and measures 45mm across. The Pilot 45 KS is available with display back or - as an option - with a solid case back.

The catchy Pilot crown is designed for optimal usability, both when winding and while setting the time. The classic pilot's-style dial with luminous hands allows a clear time reading. 

Reference UA7949BM-A1.1 is fitted with a stainless steel bracelet.",https://watchbase.r.sizr.io/watch/lg/archimede/pilot/ua7949bm-a1-1-90.jpg
Apple,Watch,,Watch 42mm,2015,No,,Sapphire,Closed,Rectangular,35.90 mm,10.50 mm,,,,Mixed,Proprietary ,Processor,Apple,Apple Watch,Digital,,,18 h,,"Hours, Minutes, Seconds, World Time","The Apple Watch in 42mm has a stainless steel case with a ceramic back in 35.9x42.0mm at a height of 10.5mm. It is splash proof though not water resistant. The 'movement' has a power reserve of 18 hours, after which it can be recharged using a magnetic charging cable. The glass on the Apple Watch version is sapphire.

Synced with an iPhone, it keeps time to within 50 milliseconds of the definitive global time standard. The 'dial' can of course be customized. It features various sensors to keep track of health and activity.

Available in a wide range of versions, the current version of the Apple Watch has a stainless steel case and a slide-through milanese bracelet.",https://watchbase.r.sizr.io/watch/lg/apple/apple-watch/mj3y2ll-d1.jpg
Breitling,Transocean,,Transocean Day & Date Red Gold / Silver / Calf / Pin,2012,No,Red Gold,Sapphire,Closed,Round,43.00 mm,12.80 mm,22.00 mm,Silver,,Stick / Dot,Stick,Automatic,Breitling,B45,Analog,29.00 mm,25,38 h,28800 bph,"Hours, Minutes, Seconds","The Breitling Transocean Day & Date is inspired by the original 1958 Transocean. It features a classical round case in a contemporary 43mm, and an understated dial with windows for both day and date.",https://watchbase.r.sizr.io/watch/lg/breitling/transocean/r4531012-g752-437x-b.jpg
Breitling,Transocean,,Transocean Day & Date Red Gold / Silver / Rubber / Folding,2012,No,Red Gold,Sapphire,Closed,Round,43.00 mm,12.80 mm,22.00 mm,Silver,,Stick / Dot,Stick,Automatic,Breitling,B45,Analog,29.00 mm,25,38 h,28800 bph,"Hours, Minutes, Seconds","The Breitling Transocean Day & Date is inspired by the original 1958 Transocean. It features a classical round case in a contemporary 43mm, and an understated dial with windows for both day and date.",https://watchbase.r.sizr.io/watch/lg/breitling/transocean/r4531012-g752-279s-r20d-3-81.png
Archimede,Pilot,,Pilot Chornograph Staineless Steel / Black,,No,Stainless steel,Sapphire,Open,Round,42.00 mm,13.60 mm,,Black,,Arabic Numerals,Sword,Automatic,ETA,7750,Analog,30.00 mm,25,42 h,28800 bph,"Hours, Minutes, Small Seconds","Classic design, engineering precision and functionality are the guidelines for this outstanding chronograph.

This Pilot watch is powered by a Swiss Made Eta 7750 Elaboré automatic movement, which offers high precision and reliability. The solid crafted three-piece case with sapphire crystal is made from finely brushed stainless steel or black PVD finished by Ickler. The Pilot Chronograph is available with display back or - as an option - with a solid case back.

The catchy Pilot crown and the large pushers are designed for optimal usability. The classic pilot's-style dial with luminous hands allows a clear time reading. The date is discreetly shown at six o'clock.

Reference UA7939-C1.3 is fitted with a dark brown leather strap.",https://watchbase.r.sizr.io/watch/lg/archimede/pilot/ua7939-c1-3-66.jpg
Archimede,Outdoor,,OutDoor 39 Protect Stainless Steel / Red / Bracelet,,No,Stainless steel,Sapphire,Closed,Round,39.00 mm,11.20 mm,20.00 mm,Red,,Arabic Numerals,Stick,Automatic,Sellita,SW200-1,Analog,25.60 mm,26,38 h,28800 bph,"Hours, Minutes, Seconds","This watch is powered by a Swiss Made SW 200-1 automatic movement, which offers high precision and reliability. The solid crafted three-piece case with sapphire crystal is made from finely brushed stainless steel finished by Ickler. 

This specific OutDoor Protect has a red dial and is fitted a stainless steel bracelet.",https://watchbase.r.sizr.io/watch/lg/archimede/outdoor/ua8239b-a6-1-h-9c.jpg
Ball Watch,Engineer Hydrocarbon,,Engineer Hydrocarbon NEDU Black / Rubber,2013,No,Titanium,Sapphire,Closed,Round,42.00 mm,17.30 mm,,Black,,Stick / Dot,Sword,Automatic,Ball Watch,RR1402C,Analog,30.00 mm,25,42 h,28800 bph,"Hours, Minutes, Small Seconds","The Ball Engineer Hydrocarbon NEDU was introduced in 2013. It was named after the Navy Experimental Diving Unit branch of the American Navy. The case measures 42mm across and is made of titanium with a ceramic bezel insert. It houses the self-winding caliber 7750 which is chronometer certified. The crown is fitted with a signature protector and an integrated helium escape valve.

Reference DC3026A-PC-BK has a black dial and a rubber strap.",https://watchbase.r.sizr.io/watch/lg/ball-watch/engineer-hydrocarbon/dc3026a-pc-bk-b7.jpg
Bell & Ross,Instruments,,BR 01 94 B-Rocket,,"Yes, 500 units",Stainless steel,Sapphire,Closed,Square,46.00 mm,,,Black,,Mixed,Sword,Automatic,ETA,2894-2,Analog,28.00 mm,37,42 h,28800 bph,"Hours, Minutes, Small Seconds","To create the BR 01 aviation watch, the Bell & Ross designers took their inspiration from aeronautical instrumentation, the ultimate reference point for legibility and reliability. Available in a variety of models, the BR 01 Instrument watch is no longer exclusively reserved for pilots. It has become an iconic watch to the great delight of watch collectors.
The present example features a stainless steel case The dial is inspired by the modernity of the 1960's and the very first American jet aircraft. The three-counter chronograph movement is automatic and also features a date window at 4:30.
Reference BR0194-B-ROCKET",https://watchbase.r.sizr.io/watch/lg/bell-ross/aviation/br0194brocket-e7.jpg
Breitling,Transocean,,Transocean Chronograph 1461 Stainless Steel / Black / Calf / Pin,,No,Stainless steel,Sapphire,Closed,Round,43.00 mm,15.25 mm,22.00 mm,Black,,Stick / Dot,Stick,Automatic,Breitling,B19,Analog,,38,42 h,28800 bph,"Hours, Minutes, Small Seconds","In the Transocean Chronograph 1461, the chronograph is combined with a complete calendar requiring adjustment only once every leap year, meaning every 1,461 days. The case measures 43mm across.",https://watchbase.r.sizr.io/watch/lg/breitling/transocean/a1931012-bb68-433x-af.jpg
Breitling,Transocean,,Transocean Day & Date Red Gold / Black / Croco / Pin,2012,No,Red Gold,Sapphire,Closed,Round,43.00 mm,12.80 mm,22.00 mm,Black,,Stick / Dot,Stick,Automatic,Breitling,B45,Analog,29.00 mm,25,38 h,28800 bph,"Hours, Minutes, Seconds","The Breitling Transocean Day & Date is inspired by the original 1958 Transocean. It features a classical round case in a contemporary 43mm, and an understated dial with windows for both day and date.",https://watchbase.r.sizr.io/watch/lg/breitling/transocean/r4531012-bb70-739p-9a.jpg
Audemars Piguet,Jules Audemars,,Jules Audemars 26344 Grande Sonnerie Carillon Platinum / The Hour Glass Black,2016,"Yes, 1 unit",Platinum,Sapphire,Open,Round,39.00 mm,11.10 mm,,Black,Yellow gold,Stick / Dot,Feuille,Handwound,Audemars Piguet,AP 2945,Analog,29.90 mm,53,48 h,21600 bph,"Hours, Minutes, Small Seconds","The Jules Audemars 26344PT.OO.D002CR.02 is a unique piece created for The Hour Glass. It features a platinum case and a black guilloché dial. It is powered by the hand-wound caliber 2945, which features a triple tone grande sonnerie, smalls seconds and a power reserve indicator.",https://watchbase.r.sizr.io/watch/lg/audemars-piguet/jules-audemars/26344pt-oo-d002cr-02-df.png
Breitling,Transocean,,Transocean Chronograph Unitime Pilot Red Gold / Blue / Croco,2013,No,Red Gold,Sapphire,Closed,Round,46.00 mm,15.40 mm,24.00 mm,Blue,,Stick / Dot,Stick,Automatic,Breitling,B05,Analog,,56,70 h,28800 bph,"Hours, Minutes, Small Seconds, World Time","The Breitling Transocean Chronograph Unitime pairs a chronograph with a world time function, courtesy of its in-house caliber B05. Thanks to its double disk, the Transocean Chronograph Unitime provides at-a-glance reading, anywhere in the world, of the time in all 24 timezones. When the user changes timezone, simply turning the crown forwards or backwards enables instant correction of the hour hand, the city disk and the 24-hour disk – while automatically adjusting the date to local time.

The Transocean Chronograph Unitime Pilot was added to the collection in 2013. It features a more instrumental and less ornamental dial, lacking the globe found on the original models.",https://watchbase.r.sizr.io/watch/lg/breitling/transocean/rb0510v1-c880-746p-d8.jpg
Breitling,Transocean,,Transocean Date Stainless Steel / Black / Bracelet,2011 - 2012,No,Stainless steel,Sapphire,Closed,Round,43.00 mm,,22.00 mm,Black,,Stick / Dot,Stick,Automatic,Breitling,B10,Analog,25.60 mm,21,42 h,28800 bph,"Hours, Minutes, Seconds","Transocean  The Transocean reinterprets the pure design of the classic 1950s and 60s in a resolutely contemporary style. The slender, understated fuselage carries onboard a high-performance “engine” in the shape of Caliber 01, entirely developed and produced in the Breitling workshops. The dial is a model of clarity and readability featuring refined details such as applied hour-markers, finely recessed and snailed counters, as well as an 18K gold version of the B initial that served for many years as the brand symbol.   REF. A1036012.BA91.154A",https://watchbase.r.sizr.io/watch/lg/breitling/transocean/a1036012ba91154a-a1.jpg
Audemars Piguet,Millenary,,Millenary Self-winding Pink Gold / Brown,,No,Pink gold,Sapphire,Open,Oval,45.00 mm,8.90 mm,,Brown,,Roman Numerals,Feuille,Automatic,Audemars Piguet,AP 3120,Analog,26.60 mm,40,60 h,21600 bph,"Hours, Minutes, Seconds",The Audemars Piguet Millenary 15320OR.OO.D095CR.01 has a pink gold case and a brown - pink dial.Inside is the brand's own caliber 3120.,https://watchbase.r.sizr.io/watch/lg/audemars-piguet/millenary/15320or-oo-d095cr-01-f0.png
Breitling,Transocean,,Transocean Chronograph Red Gold / Reverse Panda / Rubber Aero Classic,2011,No,Red Gold,Sapphire,Open,Round,43.00 mm,,22.00 mm,Black,,Stick / Dot,Stick,Automatic,Breitling,B01,Analog,,47,70 h,28800 bph,"Hours, Minutes, Small Seconds","The Transocean Chronograph reinterprets the pure design of the classic 1950s and 60s chronographs in a resolutely contemporary style. The slender, understated case of 43mm carries onboard a high-performance movement in the shape of Caliber 01, entirely developed and produced in the Breitling workshops. The dial is a model of clarity and readability featuring refined details such as applied hour-markers, finely recessed and snailed counters, as well as an 18K gold version of the B initial that served for many years as the brand symbol.",https://watchbase.r.sizr.io/watch/lg/breitling/transocean/rb015212-bf15-737p-a0.jpg
Archimede,Pilot,,Pilot Chornograph PVD / Black,,No,Stainless steel,Sapphire,Open,Round,42.00 mm,13.60 mm,,Black,,Arabic Numerals,Sword,Automatic,ETA,7750,Analog,30.00 mm,25,42 h,28800 bph,"Hours, Minutes, Small Seconds","Classic design, engineering precision and functionality are the guidelines for this outstanding chronograph.

This Pilot watch is powered by a Swiss Made Eta 7750 Elaboré automatic movement, which offers high precision and reliability. The solid crafted three-piece case with sapphire crystal is made from finely brushed stainless steel or black PVD finished by Ickler. The Pilot Chronograph is available with display back or - as an option - with a solid case back.

The catchy Pilot crown and the large pushers are designed for optimal usability. The classic pilot's-style dial with luminous hands allows a clear time reading. The date is discreetly shown at six o'clock.

Reference UA7939-C1.1-SW is fitted with a black leather strap.",https://watchbase.r.sizr.io/watch/lg/archimede/pilot/ua7939-c1-1-sw-df.jpg
Breitling,Transocean,,Transocean Day & Date Stainless Steel / Black / Calf / Pin,2012,No,Stainless steel,Sapphire,Closed,Round,43.00 mm,12.80 mm,22.00 mm,Black,,Stick / Dot,Stick,Automatic,Breitling,B45,Analog,29.00 mm,25,38 h,28800 bph,"Hours, Minutes, Seconds","The Breitling Transocean Day & Date is inspired by the original 1958 Transocean. It features a classical round case in a contemporary 43mm, and an understated dial with windows for both day and date.",https://watchbase.r.sizr.io/watch/lg/breitling/transocean/a4531012-bb69-437x-9c.jpg
Bell & Ross,Instruments,,BR 01 96 Altimeter,,"Yes, 999 units",Stainless steel,Sapphire,Closed,Square,46.00 mm,,,Black,,Arabic Numerals,Sword,Automatic,ETA,2896,Analog,25.60 mm,21,42 h,28800 bph,"Hours, Minutes, Seconds","The BR 01 ALTIMETER watch is inspired by aircraft cockpits, where each part is a reference in terms of legibility, reliability and performance. The display of the BR 01 ALTIMETER recalls the graphics of the reference instrument, the altimeter.
The present example features a stainless steel case with PVD finish and a black dial with date at 3:00 resembling a altimeter
Reference BR0192-ALTIMETER",https://watchbase.r.sizr.io/watch/lg/bell-ross/aviation/br0196-altimeter-9.png
Apple,Watch,,Watch 38mm,2015,No,,Sapphire,Closed,Rectangular,33.30 mm,10.50 mm,,,,,,Processor,Apple,Apple Watch,Digital,,,18 h,,"Hours, Minutes, Seconds, World Time","The Apple Watch in 38mm has a stainless steel case with a ceramic back in 33.3x38.6mm at a height of 10.5mm. It is splash proof though not water resistant. The 'movement' has a power reserve of 18 hours, after which it can be recharged using a magnetic charging cable. The glass on the Apple Watch version is sapphire.

Synced with an iPhone, it keeps time to within 50 milliseconds of the definitive global time standard. The 'dial' can of course be customized. It features various sensors to keep track of health and activity.

Available in a wide range of versions, the current version of the Apple Watch has a stainless steel case and a supple French-made leather strap in soft pink with so-called 'modern' buckle.",https://watchbase.r.sizr.io/watch/lg/apple/apple-watch/mj362ll-5c.jpg
Breitling,Transocean,,Transocean Date Stainless Steel / Silver / Croco / Pin,2011 - 2012,No,Stainless steel,Sapphire,Closed,Round,43.00 mm,,22.00 mm,Silver,,Stick / Dot,Stick,Automatic,Breitling,B10,Analog,25.60 mm,21,42 h,28800 bph,"Hours, Minutes, Seconds","Transocean

The Transocean reinterprets the pure design of the classic 1950s and 60s in a resolutely contemporary style. The slender, understated fuselage carries onboard a high-performance “engine” in the shape of Caliber 01, entirely developed and produced in the Breitling workshops. The dial is a model of clarity and readability featuring refined details such as applied hour-markers, finely recessed and snailed counters, as well as an 18K gold version of the B initial that served for many years as the brand symbol.



REF. A1036012.G721.737P",https://watchbase.r.sizr.io/watch/lg/breitling/transocean/a1036012g721737p-27.jpg
Breitling,Transocean,,Transocean Chronograph Stainless Steel / Panda / Croco / Folding,2011,No,Stainless steel,Sapphire,Open,Round,43.00 mm,,22.00 mm,Silver,,Stick / Dot,Stick,Automatic,Breitling,B01,Analog,,47,70 h,28800 bph,"Hours, Minutes, Small Seconds","The Transocean Chronograph reinterprets the pure design of the classic 1950s and 60s chronographs in a resolutely contemporary style. The slender, understated fuselage carries onboard a high-performance “engine” in the shape of Caliber 01, entirely developed and produced in the Breitling workshops. The dial is a model of clarity and readability featuring refined details such as applied hour-markers, finely recessed and snailed counters, as well as an 18K gold version of the B initial that served for many years as the brand symbol.

Ref. AB015212.G724 has a stainless steel case and a Mercury silver dial with anthracite sub dials.",https://watchbase.r.sizr.io/watch/lg/breitling/transocean/ab015212-g724-732p-a20d-1-2.png
Audemars Piguet,Jules Audemars,,Jules Audemars 26083 Tourbillon Chronograph White Gold / MOP,,No,White gold,Sapphire,Open,Round,41.00 mm,13.30 mm,,White,Mother of Pearl,Stick / Dot,Poire,Handwound,Audemars Piguet,AP 2889,Analog,30.50 mm,28,72 h,21600 bph,"Hours, Minutes, Small Seconds","The Jules Audemars Tourbillon Chronograph 26083BC.ZZ.D102CR.01 has a white gold case and a mother-of-pearl dial; both are heavily set with diamonds. It is powered by caliber AP 2889.

The case and buckle are set with 250 brilliant-cut and 68 baguette cut diamonds; the dial is set with 136 diamonds. A rose-cut diamond is found on the crown.",https://watchbase.r.sizr.io/watch/lg/audemars-piguet/jules-audemars/26083bc-zz-d102cr-01-fc.png
Audemars Piguet,Millenary,,Millenary Carbon One,2009,"Yes, 120 units",,Sapphire,Open,Oval,47.00 mm,16.40 mm,,Black,,Stick / Dot,Alpha,Handwound,Audemars Piguet,AP 2884,Analog,31.60 mm,30,237 h,21600 bph,"Hours, Minutes, Small Seconds",The Audemars Piguet Millenary Carbon One 26152AU.OO.D002CR.01 was introduced in 2009 as a limited edition of 120 pieces.This watch features a forged carbon case with ceramic crown and pushpieces. The movement is hand-wound.,https://watchbase.r.sizr.io/watch/lg/audemars-piguet/millenary/26152au-oo-d002cr-01-f1.png
Breitling,Transocean,,Transocean Day & Date Red Gold / Black / Calf / Folding,2012,No,Red Gold,Sapphire,Closed,Round,43.00 mm,12.80 mm,22.00 mm,Black,,Stick / Dot,Stick,Automatic,Breitling,B45,Analog,29.00 mm,25,38 h,28800 bph,"Hours, Minutes, Seconds","The Breitling Transocean Day & Date is inspired by the original 1958 Transocean. It features a classical round case in a contemporary 43mm, and an understated dial with windows for both day and date.",https://watchbase.r.sizr.io/watch/lg/breitling/transocean/r4531012-bb70-436x-r20d-1-71.png
Ball Watch,Engineer Hydrocarbon,,Engineer Hydrocarbon NEDU Blue / Rubber,2013,No,Titanium,Sapphire,Closed,Round,42.00 mm,17.30 mm,,Blue,,Stick / Dot,Sword,Automatic,Ball Watch,RR1402C,Analog,30.00 mm,25,42 h,28800 bph,"Hours, Minutes, Small Seconds","The Ball Engineer Hydrocarbon NEDU was introduced in 2013. It was named after the Navy Experimental Diving Unit branch of the American Navy. The case measures 42mm across and is made of titanium with a ceramic bezel insert. It houses the self-winding caliber 7750 which is chronometer certified. The crown is fitted with a signature protector and an integrated helium escape valve.

Reference DC3026A-PC-BE has a blue dial and a rubber strap.",https://watchbase.r.sizr.io/watch/lg/ball-watch/engineer-hydrocarbon/dc3026a-pc-be-28.jpg
Archimede,Pilot,,Pilot 45 KS Stainless Steel / Black,,No,Stainless steel,Sapphire,Open,Round,45.00 mm,10.50 mm,,Black,,Arabic Numerals,Sword,Handwound,ETA,6498-1,Analog,36.60 mm,17,46 h,18000 bph,"Hours, Minutes, Small Seconds","Classic design, engineering precision and functionality are the guidelines for this outstanding chronograph.

This Pilot 45 KS is powered by the hand-wound ETA 6498 movement, with small seconds at 6 o'clock. The solid crafted three-piece case with sapphire crystal is made from finely brushed stainless steel and measures 45mm across. The Pilot 45 KS is available with display back or - as an option - with a solid case back.

The catchy Pilot crown is designed for optimal usability, both when winding and while setting the time. The classic pilot's-style dial with luminous hands allows a clear time reading. 

Reference UA7949-H1.3 is fitted with a dark brown leather strap",https://watchbase.r.sizr.io/watch/lg/archimede/pilot/ua7949-h1-3-2b.jpg
Audemars Piguet,Millenary,,Millenary Quadriennium,2015,No,Pink gold,Sapphire,Open,Oval,47.00 mm,15.50 mm,,White,Enamel,Roman Numerals,Alpha,Handwound,Audemars Piguet,AP 2905/B01,Analog,37.90 mm,38,168 h,21600 bph,"Hours, Minutes, Small Seconds",The Audemars Piguet Millenary Quadriennium 26149OR.OO.D803CR.01 was introduced in 2015.It features the signature Millenary oval-shaped case paired with a hand-wound movement with four-year calendar.,https://watchbase.r.sizr.io/watch/lg/audemars-piguet/millenary/26149or-oo-d803cr-01-d.png
Breitling,Transocean,,Transocean Date Stainless Steel / Silver / Bracelet,2011 - 2012,No,Stainless steel,Sapphire,Closed,Round,43.00 mm,,22.00 mm,Silver,,Stick / Dot,Stick,Automatic,Breitling,B10,Analog,25.60 mm,21,42 h,28800 bph,"Hours, Minutes, Seconds","Transocean  The Transocean reinterprets the pure design of the classic 1950s and 60s in a resolutely contemporary style. The slender, understated fuselage carries onboard a high-performance “engine” in the shape of Caliber 01, entirely developed and produced in the Breitling workshops. The dial is a model of clarity and readability featuring refined details such as applied hour-markers, finely recessed and snailed counters, as well as an 18K gold version of the B initial that served for many years as the brand symbol.    REF. A1036012.G721.154A",https://watchbase.r.sizr.io/watch/lg/breitling/transocean/a1036012g721154a-63.jpg
Breitling,Transocean,,Transocean Chronograph Stainless Steel / Diamond / Panda / Croco,2011,No,Stainless steel,Sapphire,Open,Round,43.00 mm,,22.00 mm,Silver,,Stick / Dot,Stick,Automatic,Breitling,B01,Analog,,47,70 h,28800 bph,"Hours, Minutes, Small Seconds","The Transocean Chronograph reinterprets the pure design of the classic 1950s and 60s chronographs in a resolutely contemporary style. The slender, understated case of 43mm carries onboard a high-performance movement in the shape of Caliber 01, entirely developed and produced in the Breitling workshops. The dial is a model of clarity and readability featuring refined details such as applied hour-markers, finely recessed and snailed counters, as well as an 18K gold version of the B initial that served for many years as the brand symbol.",https://watchbase.r.sizr.io/watch/lg/breitling/transocean/ab015253-g724-737p-c1.jpg
Breitling,Transocean,,Transocean Chronograph Stainless Steel / Reverse Panda / Calf / Folding,2011,No,Stainless steel,Sapphire,Open,Round,43.00 mm,,22.00 mm,Black,,Stick / Dot,Stick,Automatic,Breitling,B01,Analog,,47,70 h,28800 bph,"Hours, Minutes, Small Seconds","The Transocean Chronograph reinterprets the pure design of the classic 1950s and 60s chronographs in a resolutely contemporary style. The slender, understated case of 43mm carries onboard a high-performance movement in the shape of Caliber 01, entirely developed and produced in the Breitling workshops. The dial is a model of clarity and readability featuring refined details such as applied hour-markers, finely recessed and snailed counters, as well as an 18K gold version of the B initial that served for many years as the brand symbol.

Ref. AB015212/BF26 has a black dial with contrasting sub dials.",https://watchbase.r.sizr.io/watch/lg/breitling/transocean/ab015212-bf26-112x-a20d-1-8e.png
Apple,Watch,,Watch 42mm,2015,No,,Sapphire,Closed,Rectangular,35.90 mm,10.50 mm,,,,Mixed,Proprietary ,Processor,Apple,Apple Watch,Digital,,,18 h,,"Hours, Minutes, Seconds, World Time","The Apple Watch in 42mm has a stainless steel case with a ceramic back in 35.9x42.0mm at a height of 10.5mm. It is splash proof though not water resistant. The 'movement' has a power reserve of 18 hours, after which it can be recharged using a magnetic charging cable. The glass on the Apple Watch version is sapphire.

Synced with an iPhone, it keeps time to within 50 milliseconds of the definitive global time standard. The 'dial' can of course be customized. It features various sensors to keep track of health and activity.

Available in a wide range of versions, the current version of the Apple Watch has a stainless steel case and a grey (stone) leather 'loop' strap with magnetic buckle system.",https://watchbase.r.sizr.io/watch/lg/apple/apple-watch/mj432ll-56.jpg
Breitling,Transocean,,Transocean Chronograph Stainless Steel / Diamond / Black / Croco,2011,No,Stainless steel,Sapphire,Open,Round,43.00 mm,,22.00 mm,Black,,Stick / Dot,Stick,Automatic,Breitling,B01,Analog,,47,70 h,28800 bph,"Hours, Minutes, Small Seconds","The Transocean Chronograph reinterprets the pure design of the classic 1950s and 60s chronographs in a resolutely contemporary style. The slender, understated case of 43mm carries onboard a high-performance movement in the shape of Caliber 01, entirely developed and produced in the Breitling workshops. The dial is a model of clarity and readability featuring refined details such as applied hour-markers, finely recessed and snailed counters, as well as an 18K gold version of the B initial that served for many years as the brand symbol.",https://watchbase.r.sizr.io/watch/lg/breitling/transocean/ab015253-ba99-743p-e.jpg
